{
  "ticker": "NVRI",
  "exchange": "NYSE",
  "country": "US",
  "currency": "USD",
  "cik": "0000045876",
  "source_hint": "sec",
  "period_scope": "FULL",
  "filings_expected_count": null,
  "notes": "SEC direct issuer curated in BL-093 tranche B from local filings artifacts.",
  "fiscal_year_end_month": 12,
  "company_name": "ENVIRI CORPORATION",
  "accounting_standard": "US-GAAP"
}
