{
  "ticker": "TALO",
  "exchange": "NYSE",
  "country": "US",
  "currency": "USD",
  "cik": null,
  "source_hint": "sec",
  "period_scope": "FULL",
  "filings_expected_count": null,
  "notes": "Talos Energy — oil & gas E&P. Tests DD&A mapping, ceiling test impairments, ARO terminology. Has had restructurings."
}
