{
  "ticker": "NEXN",
  "exchange": "NASDAQ",
  "country": "IL",
  "currency": "USD",
  "cik": "1849396",
  "source_hint": "sec",
  "period_scope": "FULL",
  "filings_expected_count": null,
  "notes": "Foreign private issuer (Israel/UK). Files 20-F + 6-K. Fourth test case — validates non-10-K filing types. Note: user provided CIK 1622986 (old Tremor International) but SEC ticker map resolves NEXN to CIK 1849396 (Nexxen International Ltd)."
}
