{
  "ticker": "ACVA",
  "company_name": "ACV Auctions Inc.",
  "exchange": "NYSE",
  "country": "US",
  "currency": "USD",
  "source_hint": "sec",
  "accounting_standard": "US-GAAP",
  "cik": "1637873",
  "fiscal_year_end_month": 12,
  "sector": "Business Services & Technology",
  "period_scope": "FULL"
}
