{
  "ticker": "DNOW",
  "company_name": "DNOW Inc.",
  "exchange": "NYSE",
  "country": "US",
  "currency": "USD",
  "source_hint": "sec",
  "accounting_standard": "US-GAAP",
  "cik": "1599617",
  "fiscal_year_end_month": 12,
  "period_scope": "FULL",
  "notes": "SEC direct issuer curated in BL-092 tranche A from local filings artifacts."
}
