{
  "ticker": "PR",
  "exchange": "NYSE",
  "country": "US",
  "currency": "USD",
  "cik": "0001658566",
  "source_hint": "sec",
  "period_scope": "FULL",
  "filings_expected_count": null,
  "notes": "Permian Resources Corp (formerly Centennial Resource Development through 2022-08-30). Permian Basin E&P. SIC 1311. FULL scope: annual + quarterly. Ticker PR on NYSE since Sep 2022 merger with Colgate Energy."
}
